A1: Callsign | B1: Class | C1: Score | D1: Zones | E1: Countries | F1: Comments
A2: N0FW | B2: U | C2: 326 | D2: 40 | E2: =C2-D2 -> 286
A3: OM3EY | B3: U | C3: 323 | D3: 40 | E3: =C3-D3 -> 283
A4: W1JR | B4: U | C4: 319 | D4: 40 | E4: =C4-D4 -> 279
A5: N4MM | B5: U | C5: 309 | D5: 40 | E5: =C5-D5 -> 269
A6: K4SAV | B6: U | C6: 301 | D6: 40 | E6: =C6-D6 -> 261
A7: RU6YY | B7: U | C7: 301 | D7: 40 | E7: =C7-D7 -> 261
A8: W4VQ | B8: U | C8: 294 | D8: 40 | E8: =C8-D8 -> 254 | F8: All CW
A9: WT8C | B9: U | C9: 284 | D9: 39 | E9: =C9-D9 -> 245
A10: PT7VB | B10: U | C10: 280 | D10: 36 | E10: =C10-D10 -> 244
A11: SM6CNN | B11: U | C11: 279 | D11: 40 | E11: =C11-D11 -> 239
A12: DL5NAM | B12: U | C12: 273 | D12: 40 | E12: =C12-D12 -> 233
A13: LU2NI | B13: U | C13: 268 | D13: 40 | E13: =C13-D13 -> 228
A14: SV1DPIU | B14: U | C14: 257 | D14: 40 | E14: =C14-D14 -> 217
A15: K0DEQ | B15: U | C15: 256 | D15: 40 | E15: =C15-D15 -> 216
A16: N4BAA | B16: U | C16: 256 | D16: 40 | E16: =C16-D16 -> 216
A17: W6RLL | B17: U | C17: 255 | D17: 39 | E17: =C17-D17 -> 216
A18: LZ3FN | B18: U | C18: 254 | D18: 38 | E18: =C18-D18 -> 216
A19: PS2T | B19: U | C19: 249 | D19: 40 | E19: =C19-D19 -> 209
A20: W4CU | B20: U | C20: 248 | D20: 40 | E20: =C20-D20 -> 208
A21: AD1C | B21: U | C21: 244 | D21: 39 | E21: =C21-D21 -> 205
A22: SM7CQY | B22: U | C22: 240 | D22: 38 | E22: =C22-D22 -> 202
A23: F1JKJ | B23: U | C23: 239 | D23: 40 | E23: =C23-D23 -> 199
A24: N6NG | B24: U | C24: 238 | D24: 40 | E24: =C24-D24 -> 198
A25: SM7BHM | B25: U | C25: 236 | D25: 38 | E25: =C25-D25 -> 198
A26: F5CQ | B26: U | C26: 231 | D26: 40 | E26: =C26-D26 -> 191
A27: VE3ZZ | B27: U | C27: 231 | D27: 37 | E27: =C27-D27 -> 194
A28: T94GB | B28: F | C28: 228 | D28: 35 | E28: =C28-D28 -> 193
A29: UA3QUO | B29: U | C29: 227 | D29: 39 | E29: =C29-D29 -> 188
A30: W2QO | B30: U | C30: 221 | D30: 37 | E30: =C30-D30 -> 184
A31: G1VDP | B31: U | C31: 218 | D31: 36 | E31: =C31-D31 -> 182
A32: W8AV | B32: U | C32: 217 | D32: 38 | E32: =C32-D32 -> 179
A33: NI5F | B33: U | C33: 216 | D33: 38 | E33: =C33-D33 -> 178
A34: K7EG | B34: U | C34: 211 | D34: 38 | E34: =C34-D34 -> 173
A35: W9IL | B35: U | C35: 210 | D35: 39 | E35: =C35-D35 -> 171
A36: K8AJS | B36: U | C36: 209 | D36: 37 | E36: =C36-D36 -> 172
A37: WA1Z | B37: U | C37: 208 | D37: 36 | E37: =C37-D37 -> 172
A38: VK3FM | B38: U | C38: 204 | D38: 38 | E38: =C38-D38 -> 166
A39: W0VX | B39: U | C39: 203 | D39: 36 | E39: =C39-D39 -> 167
A40: I2WIJ | B40: U | C40: 202 | D40: 38 | E40: =C40-D40 -> 164
A41: WD4DDU | B41: U | C41: 199 | D41: 35 | E41: =C41-D41 -> 164
A42: SV1CIB | B42: U | C42: 196 | D42: 39 | E42: =C42-D42 -> 157
A43: K8ZT | B43: F | C43: 194 | D43: 36 | E43: =C43-D43 -> 158
A44: AA4FU | B44: F | C44: 190 | D44: 33 | E44: =C44-D44 -> 157
A45: N7BF | B45: U | C45: 186 | D45: 39 | E45: =C45-D45 -> 147
A46: JA7OXR | B46: F | C46: 184 | D46: 40 | E46: =C46-D46 -> 144
A47: AB4IQ | B47: U | C47: 176 | D47: 36 | E47: =C47-D47 -> 140
A48: KE4MBP | B48: U | C48: 176 | D48: 33 | E48: =C48-D48 -> 143 | F48: All SSB
A49: EB1EWE | B49: U | C49: 175 | D49: 28 | E49: =C49-D49 -> 147
A50: K0ARY/VP9 | B50: U | C50: 174 | D50: 30 | E50: =C50-D50 -> 144 | F50: All 20 meters
A51: SV1CQN | B51: F | C51: 173 | D51: 35 | E51: =C51-D51 -> 138 | F51: Two points on 144 MHz
A52: VK6HG | B52: F | C52: 169 | D52: 35 | E52: =C52-D52 -> 134
A53: K9DDO | B53: U | C53: 167 | D53: 32 | E53: =C53-D53 -> 135
A54: PA0MIR | B54: F | C54: 167 | D54: 30 | E54: =C54-D54 -> 137
A55: PR7AF | B55: U | C55: 167 | D55: 33 | E55: =C55-D55 -> 134
A56: LU3JVO | B56: F | C56: 160 | D56: 38 | E56: =C56-D56 -> 122
A57: N1AM | B57: F | C57: 160 | D57: 28 | E57: =C57-D57 -> 132
A58: WF4W | B58: U | C58: 158 | D58: 32 | E58: =C58-D58 -> 126
A59: OK1BLU | B59: F | C59: 156 | D59: 30 | E59: =C59-D59 -> 126
A60: GU0SUP | B60: U | C60: 154 | D60: 33 | E60: =C60-D60 -> 121 | F60: All RTTY
A61: TA3J | B61: U | C61: 152 | D61: 31 | E61: =C61-D61 -> 121
A62: NU4B | B62: F | C62: 148 | D62: 28 | E62: =C62-D62 -> 120
A63: NT0F | B63: U | C63: 145 | D63: 31 | E63: =C63-D63 -> 114
A64: DJ6JH | B64: F | C64: 144 | D64: 32 | E64: =C64-D64 -> 112
A65: N8IW | B65: U | C65: 144 | D65: 30 | E65: =C65-D65 -> 114
A66: WA6JRZ | B66: U | C66: 140 | D66: 31 | E66: =C66-D66 -> 109 | F66: All CW
A67: JH7RTQ | B67: F | C67: 137 | D67: 33 | E67: =C67-D67 -> 104
A68: JA1NLX | B68: F | C68: 136 | D68: 32 | E68: =C68-D68 -> 104
A69: KA8PTT | B69: U | C69: 135 | D69: 28 | E69: =C69-D69 -> 107
A70: VE4EAR | B70: F | C70: 130 | D70: 29 | E70: =C70-D70 -> 101
A71: KG1V | B71: U | C71: 126 | D71: 28 | E71: =C71-D71 -> 98
A72: W8WT | B72: U | C72: 126 | D72: 27 | E72: =C72-D72 -> 99
A73: EC8AFM | B73: F | C73: 122 | D73: 24 | E73: =C73-D73 -> 98 | F73: All SSB
A74: SM7CQY | B74: U | C74: 119 | D74: 22 | E74: =C74-D74 -> 97
A75: G6OKU | B75: F | C75: 115 | D75: 23 | E75: =C75-D75 -> 92
A76: SP5CGN | B76: F | C76: 114 | D76: 25 | E76: =C76-D76 -> 89
A77: KA5EYH | B77: U | C77: 113 | D77: 29 | E77: =C77-D77 -> 84
A78: IW5EIJ | B78: F | C78: 111 | D78: 21 | E78: =C78-D78 -> 90
A79: M0OKT | B79: F | C79: 106 | D79: 22 | E79: =C79-D79 -> 84
A80: WB4DNL | B80: F | C80: 105 | D80: 27 | E80: =C80-D80 -> 78
A81: TA3YJ | B81: U | C81: 95 | D81: 18 | E81: =C81-D81 -> 77
A82: KI4LTP | B82: U | C82: 93 | D82: 18 | E82: =C82-D82 -> 75
A83: K0PK | B83: U | C83: 92 | D83: 23 | E83: =C83-D83 -> 69
A84: VA3RNJ | B84: F | C84: 75 | D84: 20 | E84: =C84-D84 -> 55
A85: W2VU | B85: F | C85: 74 | D85: 17 | E85: =C85-D85 -> 57
A86: K8CQ | B86: F | C86: 72 | D86: 17 | E86: =C86-D86 -> 55
A87: VK2KRM | B87: F | C87: 58 | D87: 18 | E87: =C87-D87 -> 40 | F87: All SSB
A88: K5PDR | B88: F | C88: 24 | D88: 10 | E88: =C88-D88 -> 14

A1: Callsign | B1: Class | C1: Score | D1: Zones | E1: Countries | F1: Comments
A2: AA4FU | B2: F | C2: 190 | D2: 33 | E2: =C2-D2 -> 157
A3: AB4IQ | B3: U | C3: 176 | D3: 36 | E3: =C3-D3 -> 140
A4: AD1C | B4: U | C4: 244 | D4: 39 | E4: =C4-D4 -> 205
A5: DJ6JH | B5: F | C5: 144 | D5: 32 | E5: =C5-D5 -> 112
A6: DL5NAM | B6: U | C6: 273 | D6: 40 | E6: =C6-D6 -> 233
A7: EB1EWE | B7: U | C7: 175 | D7: 28 | E7: =C7-D7 -> 147
A8: EC8AFM | B8: F | C8: 122 | D8: 24 | E8: =C8-D8 -> 98 | F8: All SSB
A9: F1JKJ | B9: U | C9: 239 | D9: 40 | E9: =C9-D9 -> 199
A10: F5CQ | B10: U | C10: 231 | D10: 40 | E10: =C10-D10 -> 191
A11: G1VDP | B11: U | C11: 218 | D11: 36 | E11: =C11-D11 -> 182
A12: G6OKU | B12: F | C12: 115 | D12: 23 | E12: =C12-D12 -> 92
A13: GU0SUP | B13: U | C13: 154 | D13: 33 | E13: =C13-D13 -> 121 | F13: All RTTY
A14: I2WIJ | B14: U | C14: 202 | D14: 38 | E14: =C14-D14 -> 164
A15: IW5EIJ | B15: F | C15: 111 | D15: 21 | E15: =C15-D15 -> 90
A16: JA1NLX | B16: F | C16: 136 | D16: 32 | E16: =C16-D16 -> 104
A17: JA7OXR | B17: F | C17: 184 | D17: 40 | E17: =C17-D17 -> 144
A18: JH7RTQ | B18: F | C18: 137 | D18: 33 | E18: =C18-D18 -> 104
A19: K0ARY/VP9 | B19: U | C19: 174 | D19: 30 | E19: =C19-D19 -> 144 | F19: All 20 meters
A20: K0DEQ | B20: U | C20: 256 | D20: 40 | E20: =C20-D20 -> 216
A21: K0PK | B21: U | C21: 92 | D21: 23 | E21: =C21-D21 -> 69
A22: K4SAV | B22: U | C22: 301 | D22: 40 | E22: =C22-D22 -> 261
A23: K5PDR | B23: F | C23: 24 | D23: 10 | E23: =C23-D23 -> 14
A24: K7EG | B24: U | C24: 211 | D24: 38 | E24: =C24-D24 -> 173
A25: K8AJS | B25: U | C25: 209 | D25: 37 | E25: =C25-D25 -> 172
A26: K8CQ | B26: F | C26: 72 | D26: 17 | E26: =C26-D26 -> 55
A27: K8ZT | B27: F | C27: 194 | D27: 36 | E27: =C27-D27 -> 158
A28: K9DDO | B28: U | C28: 167 | D28: 32 | E28: =C28-D28 -> 135
A29: KA5EYH | B29: U | C29: 113 | D29: 29 | E29: =C29-D29 -> 84
A30: KA8PTT | B30: U | C30: 135 | D30: 28 | E30: =C30-D30 -> 107
A31: KE4MBP | B31: U | C31: 176 | D31: 33 | E31: =C31-D31 -> 143 | F31: All SSB
A32: KG1V | B32: U | C32: 126 | D32: 28 | E32: =C32-D32 -> 98
A33: KI4LTP | B33: U | C33: 93 | D33: 18 | E33: =C33-D33 -> 75
A34: LU2NI | B34: U | C34: 268 | D34: 40 | E34: =C34-D34 -> 228
A35: LU3JVO | B35: F | C35: 160 | D35: 38 | E35: =C35-D35 -> 122
A36: LZ3FN | B36: U | C36: 254 | D36: 38 | E36: =C36-D36 -> 216
A37: M0OKT | B37: F | C37: 106 | D37: 22 | E37: =C37-D37 -> 84
A38: N0FW | B38: U | C38: 326 | D38: 40 | E38: =C38-D38 -> 286
A39: N1AM | B39: F | C39: 160 | D39: 28 | E39: =C39-D39 -> 132
A40: N4BAA | B40: U | C40: 256 | D40: 40 | E40: =C40-D40 -> 216
A41: N4MM | B41: U | C41: 309 | D41: 40 | E41: =C41-D41 -> 269
A42: N6NG | B42: U | C42: 238 | D42: 40 | E42: =C42-D42 -> 198
A43: N7BF | B43: U | C43: 186 | D43: 39 | E43: =C43-D43 -> 147
A44: N8IW | B44: U | C44: 144 | D44: 30 | E44: =C44-D44 -> 114
A45: NI5F | B45: U | C45: 216 | D45: 38 | E45: =C45-D45 -> 178
A46: NT0F | B46: U | C46: 145 | D46: 31 | E46: =C46-D46 -> 114
A47: NU4B | B47: F | C47: 148 | D47: 28 | E47: =C47-D47 -> 120
A48: OK1BLU | B48: F | C48: 156 | D48: 30 | E48: =C48-D48 -> 126
A49: OM3EY | B49: U | C49: 323 | D49: 40 | E49: =C49-D49 -> 283
A50: PA0MIR | B50: F | C50: 167 | D50: 30 | E50: =C50-D50 -> 137
A51: PR7AF | B51: U | C51: 167 | D51: 33 | E51: =C51-D51 -> 134
A52: PS2T | B52: U | C52: 249 | D52: 40 | E52: =C52-D52 -> 209
A53: PT7VB | B53: U | C53: 280 | D53: 36 | E53: =C53-D53 -> 244
A54: RU6YY | B54: U | C54: 301 | D54: 40 | E54: =C54-D54 -> 261
A55: SM6CNN | B55: U | C55: 279 | D55: 40 | E55: =C55-D55 -> 239
A56: SM7BHM | B56: U | C56: 236 | D56: 38 | E56: =C56-D56 -> 198
A57: SM7CQY | B57: U | C57: 240 | D57: 38 | E57: =C57-D57 -> 202
A58: SM7CQY | B58: U | C58: 119 | D58: 22 | E58: =C58-D58 -> 97
A59: SP5CGN | B59: F | C59: 114 | D59: 25 | E59: =C59-D59 -> 89
A60: SV1CIB | B60: U | C60: 196 | D60: 39 | E60: =C60-D60 -> 157
A61: SV1CQN | B61: F | C61: 173 | D61: 35 | E61: =C61-D61 -> 138 | F61: Two points on 144 MHz
A62: SV1DPIU | B62: U | C62: 257 | D62: 40 | E62: =C62-D62 -> 217
A63: T94GB | B63: F | C63: 228 | D63: 35 | E63: =C63-D63 -> 193
A64: TA3J | B64: U | C64: 152 | D64: 31 | E64: =C64-D64 -> 121
A65: TA3YJ | B65: U | C65: 95 | D65: 18 | E65: =C65-D65 -> 77
A66: UA3QUO | B66: U | C66: 227 | D66: 39 | E66: =C66-D66 -> 188
A67: VA3RNJ | B67: F | C67: 75 | D67: 20 | E67: =C67-D67 -> 55
A68: VE3ZZ | B68: U | C68: 231 | D68: 37 | E68: =C68-D68 -> 194
A69: VE4EAR | B69: F | C69: 130 | D69: 29 | E69: =C69-D69 -> 101
A70: VK2KRM | B70: F | C70: 58 | D70: 18 | E70: =C70-D70 -> 40 | F70: All SSB
A71: VK3FM | B71: U | C71: 204 | D71: 38 | E71: =C71-D71 -> 166
A72: VK6HG | B72: F | C72: 169 | D72: 35 | E72: =C72-D72 -> 134
A73: W0VX | B73: U | C73: 203 | D73: 36 | E73: =C73-D73 -> 167
A74: W1JR | B74: U | C74: 319 | D74: 40 | E74: =C74-D74 -> 279
A75: W2QO | B75: U | C75: 221 | D75: 37 | E75: =C75-D75 -> 184
A76: W2VU | B76: F | C76: 74 | D76: 17 | E76: =C76-D76 -> 57
A77: W4CU | B77: U | C77: 248 | D77: 40 | E77: =C77-D77 -> 208
A78: W4VQ | B78: U | C78: 294 | D78: 40 | E78: =C78-D78 -> 254 | F78: All CW
A79: W6RLL | B79: U | C79: 255 | D79: 39 | E79: =C79-D79 -> 216
A80: W8AV | B80: U | C80: 217 | D80: 38 | E80: =C80-D80 -> 179
A81: W8WT | B81: U | C81: 126 | D81: 27 | E81: =C81-D81 -> 99
A82: W9IL | B82: U | C82: 210 | D82: 39 | E82: =C82-D82 -> 171
A83: WA1Z | B83: U | C83: 208 | D83: 36 | E83: =C83-D83 -> 172
A84: WA6JRZ | B84: U | C84: 140 | D84: 31 | E84: =C84-D84 -> 109 | F84: All CW
A85: WB4DNL | B85: F | C85: 105 | D85: 27 | E85: =C85-D85 -> 78
A86: WD4DDU | B86: U | C86: 199 | D86: 35 | E86: =C86-D86 -> 164
A87: WF4W | B87: U | C87: 158 | D87: 32 | E87: =C87-D87 -> 126
A88: WT8C | B88: U | C88: 284 | D88: 39 | E88: =C88-D88 -> 245