A1: ALL SCORES | E1: MODE SCORES
A2: UNLIMITED CLASS | E2: PHONE
A3: Callsign | B3: Countries | C3: Zones | D3: Score | E3: Callsign | F3: Score
A4: OM3EY | B4: 290 | C4: 40 | D4: =ABS(B4+C4) -> 330 | E4: N0UN | F4: 323
A5: W9KNI | B5: 289 | C5: 40 | D5: =ABS(B5+C5) -> 329 | E5: N3CDA | F5: 300
A6: EA1DR | B6: 288 | C6: 40 | D6: =ABS(B6+C6) -> 328 | E6: PT7ZT | F6: 290
A7: KB0EO | B7: 287 | C7: 40 | D7: =ABS(B7+C7) -> 327 | E7: EA8MT | F7: 289
A8: IK0OZD | B8: 287 | C8: 39 | D8: =ABS(B8+C8) -> 326 | E8: PY1SX | F8: 286
A9: W1JR | B9: 285 | C9: 40 | D9: =ABS(B9+C9) -> 325 | E9: OD5ZZ | F9: 274
A10: K3KO | B10: 284 | C10: 40 | D10: =ABS(B10+C10) -> 324 | E10: N4ANV | F10: 255
A11: W7UT | B11: 285 | C11: 39 | D11: =ABS(B11+C11) -> 324 | E11: NV5E | F11: 250
A12: EA4KD | B12: 283 | C12: 40 | D12: =ABS(B12+C12) -> 323 | E12: PY2UD | F12: 249
A13: K2TQC | B13: 283 | C13: 40 | D13: =ABS(B13+C13) -> 323 | E13: W9ROG | F13: 247
A14: K5EK | B14: 283 | C14: 40 | D14: =ABS(B14+C14) -> 323 | E14: YY4DNN | F14: 240
A15: N0UN | B15: 283 | C15: 40 | D15: =ABS(B15+C15) -> 323 | E15: K4FS | F15: 229
A16: OK2SG | B16: 285 | C16: 38 | D16: =ABS(B16+C16) -> 323 | E16: PP5JR | F16: 229
A17: WN4N | B17: 283 | C17: 40 | D17: =ABS(B17+C17) -> 323 | E17: YB1UUN | F17: 229
A18: DL5AN | B18: 282 | C18: 40 | D18: =ABS(B18+C18) -> 322 | E18: ZW5B | F18: 226
A19: W2QO | B19: 282 | C19: 40 | D19: =ABS(B19+C19) -> 322 | E19: WP3GW | F19: 222
A20: K9CT | B20: 281 | C20: 40 | D20: =ABS(B20+C20) -> 321 | E20: VK3MEG | F20: 217
A21: KC6AWX | B21: 281 | C21: 40 | D21: =ABS(B21+C21) -> 321 | E21: KD8NYO | F21: 214
A22: OZ7YY | B22: 281 | C22: 40 | D22: =ABS(B22+C22) -> 321 | E22: PQ5B | F22: 200
A23: S51DX | B23: 281 | C23: 40 | D23: =ABS(B23+C23) -> 321 | E23: PS7AB | F23: 197
A24: VE1DX | B24: 282 | C24: 39 | D24: =ABS(B24+C24) -> 321 | E24: EA3FF | F24: 193
A25: AA9A | B25: 280 | C25: 40 | D25: =ABS(B25+C25) -> 320 | E25: KD8NYP | F25: 188
A26: JE1FQV | B26: 280 | C26: 40 | D26: =ABS(B26+C26) -> 320 | E26: W2WGK | F26: 186
A27: K9NB | B27: 280 | C27: 40 | D27: =ABS(B27+C27) -> 320 | E27: VU3DMP | F27: 182
A28: R6YY | B28: 280 | C28: 40 | D28: =ABS(B28+C28) -> 320 | E28: DU2BOQ | F28: 156
A29: *UT9FJ | B29: 280 | C29: 40 | D29: =ABS(B29+C29) -> 320 | E29: YF1AR | F29: 155
A30: K9NU | B30: 280 | C30: 39 | D30: =ABS(B30+C30) -> 319 | E30: PJ7MF | F30: 151
A31: VK3HJ | B31: 279 | C31: 40 | D31: =ABS(B31+C31) -> 319 | E31: PW5G | F31: 151
A32: W2IRT | B32: 279 | C32: 40 | D32: =ABS(B32+C32) -> 319 | E32: KJ4VTH | F32: 143
A33: N5JR | B33: 278 | C33: 40 | D33: =ABS(B33+C33) -> 318 | E33: CR2H | F33: 141
A34: N8DE | B34: 278 | C34: 40 | D34: =ABS(B34+C34) -> 318 | E34: VE3FCT | F34: 136
A35: UA3AGW | B35: 279 | C35: 39 | D35: =ABS(B35+C35) -> 318 | E35: PG1R | F35: 133
A36: VE2BR | B36: 278 | C36: 40 | D36: =ABS(B36+C36) -> 318 | E36: K9AMP | F36: 131
A37: DJ9ZB | B37: 279 | C37: 38 | D37: =ABS(B37+C37) -> 317 | E37: YB1JYL | F37: 124
A38: OH6RE | B38: 277 | C38: 40 | D38: =ABS(B38+C38) -> 317 | E38: PP5ZP | F38: 123
A39: PP5EG | B39: 277 | C39: 40 | D39: =ABS(B39+C39) -> 317 | E39: PU5FJR | F39: 120
A40: W3ZJ | B40: 278 | C40: 39 | D40: =ABS(B40+C40) -> 317 | E40: YB3EDD | F40: 115
A41: *9A2EU | B41: 277 | C41: 40 | D41: =ABS(B41+C41) -> 317 | E41: CE7FKG | F41: 113
A42: AI2C | B42: 276 | C42: 40 | D42: =ABS(B42+C42) -> 316 | E42: PU4HUD | F42: 103
A43: IK2QPR | B43: 276 | C43: 40 | D43: =ABS(B43+C43) -> 316 | E43: YB9WAN | F43: 86
A44: N6AR | B44: 276 | C44: 40 | D44: =ABS(B44+C44) -> 316 | E44: PY5AP | F44: 85
A45: PY4ZO | B45: 276 | C45: 40 | D45: =ABS(B45+C45) -> 316 | E45: YE4IJ | F45: 82
A46: A65CA | B46: 275 | C46: 40 | D46: =ABS(B46+C46) -> 315 | E46: K6DSW | F46: 69
A47: K8AJS | B47: 275 | C47: 40 | D47: =ABS(B47+C47) -> 315 | E47: YB0NDT | F47: 61
A48: N2BJ | B48: 276 | C48: 39 | D48: =ABS(B48+C48) -> 315 | E48: CT1AHU | F48: 48
A49: N6ML | B49: 275 | C49: 40 | D49: =ABS(B49+C49) -> 315 | E49: VE4HAZ | F49: 41
A50: W4UM | B50: 275 | C50: 40 | D50: =ABS(B50+C50) -> 315 | E50: CO2QU | F50: 30
A51: AA4SC | B51: 274 | C51: 40 | D51: =ABS(B51+C51) -> 314 | E51: FS/PJ7MF | F51: 25
A52: K3WA | B52: 274 | C52: 39 | D52: =ABS(B52+C52) -> 313 | E52: CW
A53: *JA0DAI | B53: 273 | C53: 40 | D53: =ABS(B53+C53) -> 313 | E53: UT9FJ | F53: 319
A54: K0XB | B54: 272 | C54: 40 | D54: =ABS(B54+C54) -> 312 | E54: W1RM | F54: 312
A55: N6QQ | B55: 272 | C55: 40 | D55: =ABS(B55+C55) -> 312 | E55: LY5W | F55: 311
A56: NI3P | B56: 272 | C56: 40 | D56: =ABS(B56+C56) -> 312 | E56: W4QN | F56: 310
A57: W1RM | B57: 272 | C57: 40 | D57: =ABS(B57+C57) -> 312 | E57: K4UTE | F57: 306
A58: W9OA | B58: 272 | C58: 40 | D58: =ABS(B58+C58) -> 312 | E58: N4KW | F58: 306
A59: LY5W | B59: 271 | C59: 40 | D59: =ABS(B59+C59) -> 311 | E59: W4VQ | F59: 302
A60: WK3N | B60: 273 | C60: 38 | D60: =ABS(B60+C60) -> 311 | E60: F5IN | F60: 300
A61: K7VV | B61: 272 | C61: 38 | D61: =ABS(B61+C61) -> 310 | E61: K6XT | F61: 299
A62: W4HG | B62: 272 | C62: 38 | D62: =ABS(B62+C62) -> 310 | E62: K2UF | F62: 294
A63: W4QN | B63: 270 | C63: 40 | D63: =ABS(B63+C63) -> 310 | E63: ZL2IFB | F63: 293
A64: W9OP | B64: 271 | C64: 39 | D64: =ABS(B64+C64) -> 310 | E64: WP4U | F64: 289
A65: IK2YCW | B65: 270 | C65: 39 | D65: =ABS(B65+C65) -> 309 | E65: W8AV | F65: 288
A66: YB1AR | B66: 269 | C66: 40 | D66: =ABS(B66+C66) -> 309 | E66: ON5SY | F66: 286
A67: F5CQ | B67: 269 | C67: 39 | D67: =ABS(B67+C67) -> 308 | E67: PY4HO | F67: 284
A68: G3VKW | B68: 269 | C68: 39 | D68: =ABS(B68+C68) -> 308 | E68: UA9FAR | F68: 280
A69: WX6V | B69: 268 | C69: 40 | D69: =ABS(B69+C69) -> 308 | E69: N7RD | F69: 268
A70: K1SM | B70: 267 | C70: 40 | D70: =ABS(B70+C70) -> 307 | E70: VE1RGB | F70: 263
A71: VE3CRG | B71: 267 | C71: 40 | D71: =ABS(B71+C71) -> 307 | E71: *PY5WD | F71: 251
A72: W9OA/9 | B72: 267 | C72: 40 | D72: =ABS(B72+C72) -> 307 | E72: JA6BZI | F72: 249
A73: K4UTE | B73: 266 | C73: 40 | D73: =ABS(B73+C73) -> 306 | E73: AE5X | F73: 242
A74: KT0DX | B74: 266 | C74: 40 | D74: =ABS(B74+C74) -> 306 | E74: N5KM | F74: 242
A75: N0KE | B75: 267 | C75: 39 | D75: =ABS(B75+C75) -> 306 | E75: YV5EN | F75: 230
A76: N4KW | B76: 266 | C76: 40 | D76: =ABS(B76+C76) -> 306 | E76: FG8NY | F76: 215
A77: N8AGU | B77: 266 | C77: 40 | D77: =ABS(B77+C77) -> 306 | E77: W5ZO | F77: 210
A78: ON4ON | B78: 268 | C78: 38 | D78: =ABS(B78+C78) -> 306 | E78: NU4B | F78: 206
A79: W6XK | B79: 266 | C79: 40 | D79: =ABS(B79+C79) -> 306 | E79: *EW7SM | F79: 202
A80: W4VIC | B80: 265 | C80: 40 | D80: =ABS(B80+C80) -> 305 | E80: W2OR | F80: 202
A81: *DL8ZAW | B81: 265 | C81: 40 | D81: =ABS(B81+C81) -> 305 | E81: N7WO | F81: 186
A82: G5LP | B82: 266 | C82: 38 | D82: =ABS(B82+C82) -> 304 | E82: IK2FIL | F82: 177
A83: N4MM | B83: 267 | C83: 37 | D83: =ABS(B83+C83) -> 304 | E83: OO9O | F83: 165
A84: W2LK | B84: 264 | C84: 39 | D84: =ABS(B84+C84) -> 303 | E84: PR7HR | F84: 160
A85: K6YK | B85: 262 | C85: 40 | D85: =ABS(B85+C85) -> 302 | E85: PX2B | F85: 148
A86: W4VQ | B86: 263 | C86: 39 | D86: =ABS(B86+C86) -> 302 | E86: HB9CBR | F86: 141
A87: IK2DJV | B87: 261 | C87: 40 | D87: =ABS(B87+C87) -> 301 | E87: KD8SAV | F87: 134
A88: K6FW | B88: 262 | C88: 39 | D88: =ABS(B88+C88) -> 301 | E88: JH1GBO | F88: 128
A89: OH5BM | B89: 265 | C89: 36 | D89: =ABS(B89+C89) -> 301 | E89: PY5AKW | F89: 120
A90: VE5UA | B90: 261 | C90: 40 | D90: =ABS(B90+C90) -> 301 | E90: YE1C | F90: 106
A91: F5IN | B91: 261 | C91: 39 | D91: =ABS(B91+C91) -> 300 | E91: F6KRD | F91: 86
A92: N3CDA | B92: 260 | C92: 40 | D92: =ABS(B92+C92) -> 300 | E92: VE1DT | F92: 46
A93: AB1OC | B93: 262 | C93: 37 | D93: =ABS(B93+C93) -> 299 | E93: PY1CPF | F93: 8
A94: K6XT | B94: 261 | C94: 38 | D94: =ABS(B94+C94) -> 299 | E94: DIGITAL
A95: LU5VV | B95: 259 | C95: 40 | D95: =ABS(B95+C95) -> 299 | E95: *WS3N | F95: 261
A96: LY5M | B96: 259 | C96: 40 | D96: =ABS(B96+C96) -> 299 | E96: N5MOA | F96: 252
A97: LZ2TW | B97: 264 | C97: 35 | D97: =ABS(B97+C97) -> 299 | E97: IK5FKF | F97: 244
A98: YO9HP | B98: 260 | C98: 39 | D98: =ABS(B98+C98) -> 299 | E98: IK2RPE | F98: 209
A99: SM0MPV | B99: 258 | C99: 40 | D99: =ABS(B99+C99) -> 298 | E99: GU0SUP | F99: 187
A100: WA4DT | B100: 259 | C100: 39 | D100: =ABS(B100+C100) -> 298 | E100: W2GHD | F100: 139
A101: EI7CC | B101: 257 | C101: 40 | D101: =ABS(B101+C101) -> 297 | E101: CO2VE | F101: 118
A102: AA8R | B102: 257 | C102: 39 | D102: =ABS(B102+C102) -> 296 | E102: K9WIS | F102: 94
A103: K9KK | B103: 258 | C103: 38 | D103: =ABS(B103+C103) -> 296 | E103: NN6NN | F103: 77
A104: W6GX | B104: 257 | C104: 39 | D104: =ABS(B104+C104) -> 296 | E104: CO2HA | F104: 72
A105: VE3ZZ | B105: 255 | C105: 40 | D105: =ABS(B105+C105) -> 295
A106: W3GQ | B106: 258 | C106: 37 | D106: =ABS(B106+C106) -> 295
A107: W6RS | B107: 260 | C107: 35 | D107: =ABS(B107+C107) -> 295
A108: K1SND | B108: 255 | C108: 39 | D108: =ABS(B108+C108) -> 294
A109: K2UF | B109: 256 | C109: 38 | D109: =ABS(B109+C109) -> 294
A110: *YE1NZ | B110: 258 | C110: 36 | D110: =ABS(B110+C110) -> 294
A111: *PP1CZ | B111: 254 | C111: 39 | D111: =ABS(B111+C111) -> 293
A112: ZL2IFB | B112: 253 | C112: 40 | D112: =ABS(B112+C112) -> 293
A113: VK3EW | B113: 253 | C113: 39 | D113: =ABS(B113+C113) -> 292
A114: JG3FEA | B114: 251 | C114: 40 | D114: =ABS(B114+C114) -> 291
A115: PY4OY | B115: 251 | C115: 40 | D115: =ABS(B115+C115) -> 291
A116: HA0HW | B116: 250 | C116: 40 | D116: =ABS(B116+C116) -> 290
A117: *OM3DX | B117: 251 | C117: 39 | D117: =ABS(B117+C117) -> 290
A118: PT7ZT | B118: 251 | C118: 39 | D118: =ABS(B118+C118) -> 290
A119: EA8MT | B119: 249 | C119: 40 | D119: =ABS(B119+C119) -> 289
A120: W0RIC | B120: 253 | C120: 36 | D120: =ABS(B120+C120) -> 289
A121: WP4U | B121: 253 | C121: 36 | D121: =ABS(B121+C121) -> 289
A122: FG8OJ | B122: 252 | C122: 36 | D122: =ABS(B122+C122) -> 288
A123: K1QS | B123: 248 | C123: 40 | D123: =ABS(B123+C123) -> 288
A124: W8AV | B124: 248 | C124: 40 | D124: =ABS(B124+C124) -> 288
A125: WS7L | B125: 247 | C125: 40 | D125: =ABS(B125+C125) -> 287
A126: K5JTH | B126: 247 | C126: 39 | D126: =ABS(B126+C126) -> 286
A127: ON5SY | B127: 249 | C127: 37 | D127: =ABS(B127+C127) -> 286
A128: PY1SX | B128: 246 | C128: 40 | D128: =ABS(B128+C128) -> 286
A129: W3MC | B129: 246 | C129: 40 | D129: =ABS(B129+C129) -> 286
A130: IZ0CBB | B130: 245 | C130: 39 | D130: =ABS(B130+C130) -> 284
A131: K1ESE | B131: 245 | C131: 39 | D131: =ABS(B131+C131) -> 284
A132: PY4HO | B132: 245 | C132: 39 | D132: =ABS(B132+C132) -> 284
A133: IZ8BRI | B133: 244 | C133: 39 | D133: =ABS(B133+C133) -> 283
A134: ON4CAS | B134: 243 | C134: 40 | D134: =ABS(B134+C134) -> 283
A135: WA5VGI | B135: 245 | C135: 38 | D135: =ABS(B135+C135) -> 283
A136: WB4YDL | B136: 244 | C136: 39 | D136: =ABS(B136+C136) -> 283
A137: W4CU | B137: 242 | C137: 40 | D137: =ABS(B137+C137) -> 282
A138: PY1ON | B138: 242 | C138: 39 | D138: =ABS(B138+C138) -> 281
A139: UA9FAR | B139: 240 | C139: 40 | D139: =ABS(B139+C139) -> 280
A140: VK4CC | B140: 243 | C140: 37 | D140: =ABS(B140+C140) -> 280
A141: GM7TUD | B141: 240 | C141: 39 | D141: =ABS(B141+C141) -> 279
A142: W2LE | B142: 239 | C142: 40 | D142: =ABS(B142+C142) -> 279
A143: *KE9I | B143: 239 | C143: 40 | D143: =ABS(B143+C143) -> 279
A144: YB0MWM | B144: 239 | C144: 39 | D144: =ABS(B144+C144) -> 278
A145: N9LAH | B145: 237 | C145: 40 | D145: =ABS(B145+C145) -> 277
A146: SV9COL | B146: 239 | C146: 38 | D146: =ABS(B146+C146) -> 277
A147: PY2IU | B147: 236 | C147: 40 | D147: =ABS(B147+C147) -> 276
A148: WA4JQS | B148: 235 | C148: 40 | D148: =ABS(B148+C148) -> 275
A149: OD5ZZ | B149: 238 | C149: 36 | D149: =ABS(B149+C149) -> 274
A150: K7LVJ | B150: 234 | C150: 39 | D150: =ABS(B150+C150) -> 273
A151: HK3W | B151: 234 | C151: 38 | D151: =ABS(B151+C151) -> 272
A152: N1EN | B152: 232 | C152: 40 | D152: =ABS(B152+C152) -> 272
A153: W0EWM | B153: 231 | C153: 40 | D153: =ABS(B153+C153) -> 271
A154: K1ZO | B154: 230 | C154: 40 | D154: =ABS(B154+C154) -> 270
A155: K5DC | B155: 232 | C155: 38 | D155: =ABS(B155+C155) -> 270
A156: K9MK | B156: 230 | C156: 40 | D156: =ABS(B156+C156) -> 270
A157: *PY4RGS | B157: 230 | C157: 40 | D157: =ABS(B157+C157) -> 270
A158: N0RB | B158: 230 | C158: 39 | D158: =ABS(B158+C158) -> 269
A159: PY2RN | B159: 229 | C159: 40 | D159: =ABS(B159+C159) -> 269
A160: W8BBQ | B160: 231 | C160: 38 | D160: =ABS(B160+C160) -> 269
A161: N7RD | B161: 228 | C161: 40 | D161: =ABS(B161+C161) -> 268
A162: VE1OP | B162: 230 | C162: 38 | D162: =ABS(B162+C162) -> 268
A163: WD9DZV | B163: 229 | C163: 39 | D163: =ABS(B163+C163) -> 268
A164: WO7R | B164: 229 | C164: 39 | D164: =ABS(B164+C164) -> 268
A165: *K9YC | B165: 227 | C165: 40 | D165: =ABS(B165+C165) -> 267
A166: PY3OZ | B166: 226 | C166: 40 | D166: =ABS(B166+C166) -> 266
A167: PY2EL | B167: 226 | C167: 39 | D167: =ABS(B167+C167) -> 265
A168: W1FQ | B168: 225 | C168: 39 | D168: =ABS(B168+C168) -> 264
A169: LA8AW | B169: 224 | C169: 39 | D169: =ABS(B169+C169) -> 263
A170: *K5BG | B170: 223 | C170: 39 | D170: =ABS(B170+C170) -> 262
A171: *W8DX | B171: 222 | C171: 40 | D171: =ABS(B171+C171) -> 262
A172: YB0MZI/4 | B172: 226 | C172: 36 | D172: =ABS(B172+C172) -> 262
A173: JN3SAC | B173: 223 | C173: 38 | D173: =ABS(B173+C173) -> 261
A174: PY2KP | B174: 221 | C174: 40 | D174: =ABS(B174+C174) -> 261
A175: *WS3N | B175: 221 | C175: 40 | D175: =ABS(B175+C175) -> 261
A176: K0LUZ | B176: 221 | C176: 39 | D176: =ABS(B176+C176) -> 260
A177: K5WAF | B177: 221 | C177: 39 | D177: =ABS(B177+C177) -> 260
A178: N8AG | B178: 220 | C178: 40 | D178: =ABS(B178+C178) -> 260
A179: PT2AP | B179: 223 | C179: 37 | D179: =ABS(B179+C179) -> 260
A180: *SP3NYG | B180: 220 | C180: 40 | D180: =ABS(B180+C180) -> 260
A181: AA4FU | B181: 219 | C181: 40 | D181: =ABS(B181+C181) -> 259
A182: K4MM | B182: 222 | C182: 37 | D182: =ABS(B182+C182) -> 259
A183: W1EBI | B183: 219 | C183: 40 | D183: =ABS(B183+C183) -> 259
A184: PY1NX | B184: 218 | C184: 40 | D184: =ABS(B184+C184) -> 258
A185: K7ACZ | B185: 218 | C185: 39 | D185: =ABS(B185+C185) -> 257
A186: W2NK | B186: 221 | C186: 36 | D186: =ABS(B186+C186) -> 257
A187: *K2DSW | B187: 216 | C187: 40 | D187: =ABS(B187+C187) -> 256
A188: *WU9B | B188: 220 | C188: 36 | D188: =ABS(B188+C188) -> 256
A189: N4ANV | B189: 218 | C189: 37 | D189: =ABS(B189+C189) -> 255
A190: *PY2ZEA | B190: 217 | C190: 38 | D190: =ABS(B190+C190) -> 255
A191: OE1WEU | B191: 217 | C191: 37 | D191: =ABS(B191+C191) -> 254
A192: VK3FM | B192: 215 | C192: 39 | D192: =ABS(B192+C192) -> 254
A193: AA4R | B193: 213 | C193: 40 | D193: =ABS(B193+C193) -> 253
A194: K9OR | B194: 214 | C194: 39 | D194: =ABS(B194+C194) -> 253
A195: N8MZ | B195: 214 | C195: 39 | D195: =ABS(B195+C195) -> 253
A196: W2RDS | B196: 214 | C196: 39 | D196: =ABS(B196+C196) -> 253
A197: N5MOA | B197: 212 | C197: 40 | D197: =ABS(B197+C197) -> 252
A198: NV5E | B198: 213 | C198: 37 | D198: =ABS(B198+C198) -> 250
A199: VE5MX | B199: 212 | C199: 38 | D199: =ABS(B199+C199) -> 250
A200: W9ILY | B200: 210 | C200: 40 | D200: =ABS(B200+C200) -> 250
A201: JA6BZI | B201: 211 | C201: 38 | D201: =ABS(B201+C201) -> 249
A202: PY2UD | B202: 211 | C202: 38 | D202: =ABS(B202+C202) -> 249
A203: IK2SGB | B203: 210 | C203: 38 | D203: =ABS(B203+C203) -> 248
A204: KI0J | B204: 212 | C204: 36 | D204: =ABS(B204+C204) -> 248
A205: *N0AH | B205: 212 | C205: 36 | D205: =ABS(B205+C205) -> 248
A206: K3NK | B206: 207 | C206: 40 | D206: =ABS(B206+C206) -> 247
A207: K4NC | B207: 209 | C207: 38 | D207: =ABS(B207+C207) -> 247
A208: KC9QQ | B208: 210 | C208: 37 | D208: =ABS(B208+C208) -> 247
A209: KY7M | B209: 207 | C209: 40 | D209: =ABS(B209+C209) -> 247
A210: OH2BEN | B210: 208 | C210: 39 | D210: =ABS(B210+C210) -> 247
A211: VE9HF | B211: 208 | C211: 39 | D211: =ABS(B211+C211) -> 247
A212: W9ROG | B212: 211 | C212: 36 | D212: =ABS(B212+C212) -> 247
A213: HA8KW | B213: 211 | C213: 35 | D213: =ABS(B213+C213) -> 246
A214: K2SX | B214: 206 | C214: 40 | D214: =ABS(B214+C214) -> 246
A215: W6GJB | B215: 207 | C215: 38 | D215: =ABS(B215+C215) -> 245
A216: ZS6GRL | B216: 211 | C216: 34 | D216: =ABS(B216+C216) -> 245
A217: IK5FKF | B217: 206 | C217: 38 | D217: =ABS(B217+C217) -> 244
A218: N2RJ | B218: 207 | C218: 37 | D218: =ABS(B218+C218) -> 244
A219: AE5X | B219: 203 | C219: 39 | D219: =ABS(B219+C219) -> 242
A220: N5KM | B220: 203 | C220: 39 | D220: =ABS(B220+C220) -> 242
A221: PR8ZX | B221: 205 | C221: 37 | D221: =ABS(B221+C221) -> 242
A222: VA7ZT | B222: 202 | C222: 39 | D222: =ABS(B222+C222) -> 241
A223: N4PQX | B223: 200 | C223: 40 | D223: =ABS(B223+C223) -> 240
A224: NC4MI | B224: 205 | C224: 35 | D224: =ABS(B224+C224) -> 240
A225: W2YE | B225: 201 | C225: 39 | D225: =ABS(B225+C225) -> 240
A226: YY4DNN | B226: 204 | C226: 36 | D226: =ABS(B226+C226) -> 240
A227: VK2MWG | B227: 201 | C227: 37 | D227: =ABS(B227+C227) -> 238
A228: PY1KR | B228: 198 | C228: 39 | D228: =ABS(B228+C228) -> 237
A229: UA9AGX | B229: 198 | C229: 39 | D229: =ABS(B229+C229) -> 237
A230: W0VX | B230: 199 | C230: 38 | D230: =ABS(B230+C230) -> 237
A231: YB4IR | B231: 200 | C231: 36 | D231: =ABS(B231+C231) -> 236
A232: K8YC | B232: 196 | C232: 39 | D232: =ABS(B232+C232) -> 235
A233: NR9J | B233: 199 | C233: 36 | D233: =ABS(B233+C233) -> 235
A234: LX1ER | B234: 196 | C234: 38 | D234: =ABS(B234+C234) -> 234
A235: PY5VC | B235: 196 | C235: 38 | D235: =ABS(B235+C235) -> 234
A236: ZS6A | B236: 196 | C236: 35 | D236: =ABS(B236+C236) -> 231
A237: LA2LI | B237: 194 | C237: 36 | D237: =ABS(B237+C237) -> 230
A238: VE9AA | B238: 194 | C238: 36 | D238: =ABS(B238+C238) -> 230
A239: YV5EN | B239: 195 | C239: 35 | D239: =ABS(B239+C239) -> 230
A240: K4FS | B240: 190 | C240: 39 | D240: =ABS(B240+C240) -> 229
A241: NY9H | B241: 191 | C241: 38 | D241: =ABS(B241+C241) -> 229
A242: PP5JR | B242: 191 | C242: 38 | D242: =ABS(B242+C242) -> 229
A243: VY2SS | B243: 190 | C243: 39 | D243: =ABS(B243+C243) -> 229
A244: YB1UUN | B244: 192 | C244: 37 | D244: =ABS(B244+C244) -> 229
A245: PY1ZV | B245: 192 | C245: 36 | D245: =ABS(B245+C245) -> 228
A246: YB1TJ | B246: 192 | C246: 36 | D246: =ABS(B246+C246) -> 228
A247: W1NK | B247: 190 | C247: 37 | D247: =ABS(B247+C247) -> 227
A248: WH7DX | B248: 187 | C248: 40 | D248: =ABS(B248+C248) -> 227
A249: YC2BYC | B249: 194 | C249: 33 | D249: =ABS(B249+C249) -> 227
A250: ZW5B | B250: 187 | C250: 39 | D250: =ABS(B250+C250) -> 226
A251: PY6TS | B251: 185 | C251: 40 | D251: =ABS(B251+C251) -> 225
A252: YC0QR | B252: 186 | C252: 38 | D252: =ABS(B252+C252) -> 224
A253: KD4POJ | B253: 185 | C253: 38 | D253: =ABS(B253+C253) -> 223
A254: N7US | B254: 184 | C254: 38 | D254: =ABS(B254+C254) -> 222
A255: PY2CX | B255: 183 | C255: 39 | D255: =ABS(B255+C255) -> 222
A256: PY2VA | B256: 187 | C256: 35 | D256: =ABS(B256+C256) -> 222
A257: VU2PTT | B257: 183 | C257: 39 | D257: =ABS(B257+C257) -> 222
A258: W3OA | B258: 183 | C258: 39 | D258: =ABS(B258+C258) -> 222
A259: W9RPM | B259: 187 | C259: 35 | D259: =ABS(B259+C259) -> 222
A260: WP3GW | B260: 190 | C260: 32 | D260: =ABS(B260+C260) -> 222
A261: AB6Z | B261: 189 | C261: 32 | D261: =ABS(B261+C261) -> 221
A262: PT2ON | B262: 191 | C262: 30 | D262: =ABS(B262+C262) -> 221
A263: CT3HF | B263: 182 | C263: 38 | D263: =ABS(B263+C263) -> 220
A264: *SM7BHM | B264: 182 | C264: 38 | D264: =ABS(B264+C264) -> 220
A265: KS0T | B265: 181 | C265: 38 | D265: =ABS(B265+C265) -> 219
A266: 4Z4DX | B266: 179 | C266: 39 | D266: =ABS(B266+C266) -> 218
A267: DF9DD | B267: 183 | C267: 35 | D267: =ABS(B267+C267) -> 218
A268: VK3MEG | B268: 180 | C268: 37 | D268: =ABS(B268+C268) -> 217
A269: KK9H | B269: 179 | C269: 37 | D269: =ABS(B269+C269) -> 216
A270: NK0S | B270: 177 | C270: 39 | D270: =ABS(B270+C270) -> 216
A271: VE1ZA | B271: 177 | C271: 39 | D271: =ABS(B271+C271) -> 216
A272: PA0MIR | B272: 177 | C272: 38 | D272: =ABS(B272+C272) -> 215
A273: GI4SJQ | B273: 179 | C273: 35 | D273: =ABS(B273+C273) -> 214
A274: WC3W | B274: 176 | C274: 38 | D274: =ABS(B274+C274) -> 214
A275: *YB2LSR | B275: 177 | C275: 37 | D275: =ABS(B275+C275) -> 214
A276: K0ARY | B276: 176 | C276: 37 | D276: =ABS(B276+C276) -> 213
A277: PP5EJ | B277: 178 | C277: 35 | D277: =ABS(B277+C277) -> 213
A278: K9CJ | B278: 172 | C278: 39 | D278: =ABS(B278+C278) -> 211
A279: WA9MAG | B279: 175 | C279: 36 | D279: =ABS(B279+C279) -> 211
A280: XV4Y | B280: 172 | C280: 39 | D280: =ABS(B280+C280) -> 211
A281: KU5B | B281: 170 | C281: 40 | D281: =ABS(B281+C281) -> 210
A282: PP5BZ | B282: 171 | C282: 39 | D282: =ABS(B282+C282) -> 210
A283: PY3YD | B283: 172 | C283: 38 | D283: =ABS(B283+C283) -> 210
A284: W5ZO | B284: 178 | C284: 32 | D284: =ABS(B284+C284) -> 210
A285: IK2RPE | B285: 173 | C285: 36 | D285: =ABS(B285+C285) -> 209
A286: VE9ML | B286: 170 | C286: 39 | D286: =ABS(B286+C286) -> 209
A287: XE1EE | B287: 170 | C287: 38 | D287: =ABS(B287+C287) -> 208
A288: W5GWH | B288: 169 | C288: 37 | D288: =ABS(B288+C288) -> 206
A289: VE1JS | B289: 170 | C289: 34 | D289: =ABS(B289+C289) -> 204
A290: OH6MW | B290: 166 | C290: 37 | D290: =ABS(B290+C290) -> 203
A291: YB8HZ | B291: 171 | C291: 31 | D291: =ABS(B291+C291) -> 202
A292: A65BD | B292: 165 | C292: 35 | D292: =ABS(B292+C292) -> 200
A293: BV1EK | B293: 161 | C293: 39 | D293: 200
A294: PQ5B | B294: 162 | C294: 38 | D294: =ABS(B294+C294) -> 200
A295: K9IR | B295: 165 | C295: 34 | D295: =ABS(B295+C295) -> 199
A296: KN3A | B296: 165 | C296: 34 | D296: =ABS(B296+C296) -> 199
A297: N3QE | B297: 163 | C297: 35 | D297: =ABS(B297+C297) -> 198
A298: N5PG | B298: 159 | C298: 39 | D298: =ABS(B298+C298) -> 198
A299: PS2T | B299: 158 | C299: 40 | D299: =ABS(B299+C299) -> 198
A300: PS7AB | B300: 162 | C300: 35 | D300: =ABS(B300+C300) -> 197
A301: VE9OA | B301: 163 | C301: 33 | D301: =ABS(B301+C301) -> 196
A302: PY2XV | B302: 161 | C302: 34 | D302: =ABS(B302+C302) -> 195
A303: WW1MM | B303: 159 | C303: 36 | D303: =ABS(B303+C303) -> 195
A304: LU8ADX | B304: 153 | C304: 38 | D304: =ABS(B304+C304) -> 191
A305: PY5IP | B305: 155 | C305: 36 | D305: =ABS(B305+C305) -> 191
A306: YB3MM | B306: 153 | C306: 37 | D306: =ABS(B306+C306) -> 190
A307: XQ7UP | B307: 151 | C307: 38 | D307: =ABS(B307+C307) -> 189
A308: 9V1PW | B308: 152 | C308: 36 | D308: =ABS(B308+C308) -> 188
A309: AB1QB | B309: 150 | C309: 38 | D309: =ABS(B309+C309) -> 188
A310: GU0SUP | B310: 148 | C310: 39 | D310: =ABS(B310+C310) -> 187
A311: N7WO | B311: 151 | C311: 35 | D311: =ABS(B311+C311) -> 186
A312: K1MIJ | B312: 150 | C312: 35 | D312: =ABS(B312+C312) -> 185
A313: PT5T | B313: 146 | C313: 38 | D313: =ABS(B313+C313) -> 184
A314: VK5DG | B314: 145 | C314: 39 | D314: =ABS(B314+C314) -> 184
A315: W2DZ | B315: 151 | C315: 32 | D315: =ABS(B315+C315) -> 183
A316: YB2TJV | B316: 155 | C316: 28 | D316: =ABS(B316+C316) -> 183
A317: VU3DMP | B317: 151 | C317: 31 | D317: =ABS(B317+C317) -> 182
A318: AJ4FM | B318: 147 | C318: 33 | D318: =ABS(B318+C318) -> 180
A319: CO2AJ | B319: 147 | C319: 33 | D319: =ABS(B319+C319) -> 180
A320: N4IS | B320: 143 | C320: 35 | D320: =ABS(B320+C320) -> 178
A321: PY2KJ | B321: 140 | C321: 38 | D321: =ABS(B321+C321) -> 178
A322: VY2LI | B322: 139 | C322: 37 | D322: =ABS(B322+C322) -> 176
A323: W6ZQ | B323: 144 | C323: 32 | D323: =ABS(B323+C323) -> 176
A324: KZ2I | B324: 137 | C324: 37 | D324: =ABS(B324+C324) -> 174
A325: YB1LZ | B325: 136 | C325: 38 | D325: =ABS(B325+C325) -> 174
A326: YV6BXN | B326: 141 | C326: 33 | D326: =ABS(B326+C326) -> 174
A327: PY5KC | B327: 137 | C327: 34 | D327: =ABS(B327+C327) -> 171
A328: NK5A | B328: 136 | C328: 34 | D328: =ABS(B328+C328) -> 170
A329: J34J | B329: 136 | C329: 33 | D329: =ABS(B329+C329) -> 169
A330: *CE3OP | B330: 131 | C330: 34 | D330: =ABS(B330+C330) -> 165
A331: K9XE | B331: 131 | C331: 32 | D331: =ABS(B331+C331) -> 163
A332: PR7HR | B332: 127 | C332: 33 | D332: =ABS(B332+C332) -> 160
A333: *OH5RF | B333: 126 | C333: 29 | D333: =ABS(B333+C333) -> 155
A334: K4IQJ | B334: 122 | C334: 31 | D334: =ABS(B334+C334) -> 153
A335: KF7PBM | B335: 123 | C335: 30 | D335: =ABS(B335+C335) -> 153
A336: PJ7MF | B336: 117 | C336: 34 | D336: =ABS(B336+C336) -> 151
A337: PW5G | B337: 115 | C337: 36 | D337: =ABS(B337+C337) -> 151
A338: DU1IVT | B338: 115 | C338: 35 | D338: =ABS(B338+C338) -> 150
A339: PY2MC | B339: 116 | C339: 33 | D339: =ABS(B339+C339) -> 149
A340: YB1HK | B340: 116 | C340: 33 | D340: =ABS(B340+C340) -> 149
A341: JG1WCT | B341: 116 | C341: 32 | D341: =ABS(B341+C341) -> 148
A342: K3TW | B342: 114 | C342: 34 | D342: =ABS(B342+C342) -> 148
A343: K7ZV | B343: 117 | C343: 31 | D343: =ABS(B343+C343) -> 148
A344: PX2B | B344: 112 | C344: 36 | D344: =ABS(B344+C344) -> 148
A345: YB1FWO | B345: 116 | C345: 31 | D345: =ABS(B345+C345) -> 147
A346: CR2H | B346: 106 | C346: 35 | D346: =ABS(B346+C346) -> 141
A347: IZ1TRG | B347: 112 | C347: 29 | D347: =ABS(B347+C347) -> 141
A348: GW4EVX | B348: 111 | C348: 29 | D348: =ABS(B348+C348) -> 140
A349: YC1CWK | B349: 117 | C349: 23 | D349: =ABS(B349+C349) -> 140
A350: K9DDO/4 | B350: 112 | C350: 27 | D350: =ABS(B350+C350) -> 139
A351: PY2BK | B351: 120 | C351: 17 | D351: =ABS(B351+C351) -> 137
A352: VE1BVD | B352: 105 | C352: 32 | D352: =ABS(B352+C352) -> 137
A353: CE4KCA | B353: 106 | C353: 27 | D353: =ABS(B353+C353) -> 133
A354: W1KSZ | B354: 100 | C354: 33 | D354: =ABS(B354+C354) -> 133
A355: PY2YU | B355: 98 | C355: 34 | D355: =ABS(B355+C355) -> 132
A356: K9AMP | B356: 107 | C356: 24 | D356: =ABS(B356+C356) -> 131
A357: VU2CDP | B357: 100 | C357: 31 | D357: =ABS(B357+C357) -> 131
A358: KG5VK | B358: 97 | C358: 32 | D358: =ABS(B358+C358) -> 129
A359: PY2ADR | B359: 97 | C359: 32 | D359: =ABS(B359+C359) -> 129
A360: WT8E | B360: 102 | C360: 27 | D360: =ABS(B360+C360) -> 129
A361: KI4TZ | B361: 97 | C361: 29 | D361: =ABS(B361+C361) -> 126
A362: YB1JYL | B362: 99 | C362: 25 | D362: =ABS(B362+C362) -> 124
A363: PP5ZP | B363: 93 | C363: 30 | D363: =ABS(B363+C363) -> 123
A364: PY1TR | B364: 93 | C364: 30 | D364: =ABS(B364+C364) -> 123
A365: W9VA | B365: 91 | C365: 32 | D365: =ABS(B365+C365) -> 123
A366: NF8I | B366: 97 | C366: 25 | D366: =ABS(B366+C366) -> 122
A367: VY2MP | B367: 93 | C367: 28 | D367: =ABS(B367+C367) -> 121
A368: PU5FJR | B368: 92 | C368: 28 | D368: =ABS(B368+C368) -> 120
A369: PY5AKW | B369: 94 | C369: 26 | D369: =ABS(B369+C369) -> 120
A370: PY5FB | B370: 88 | C370: 27 | D370: =ABS(B370+C370) -> 115
A371: YB3EDD | B371: 90 | C371: 25 | D371: =ABS(B371+C371) -> 115
A372: W9MU | B372: 84 | C372: 29 | D372: =ABS(B372+C372) -> 113
A373: YE90PK | B373: 87 | C373: 26 | D373: =ABS(B373+C373) -> 113
A374: YB2ECG | B374: 83 | C374: 29 | D374: =ABS(B374+C374) -> 112
A375: 7P8PB | B375: 82 | C375: 29 | D375: =ABS(B375+C375) -> 111
A376: AF5Q | B376: 83 | C376: 26 | D376: =ABS(B376+C376) -> 109
A377: PT2AZ | B377: 88 | C377: 20 | D377: =ABS(B377+C377) -> 108
A378: YE1C | B378: 79 | C378: 27 | D378: =ABS(B378+C378) -> 106
A379: PU4HUD | B379: 77 | C379: 26 | D379: =ABS(B379+C379) -> 103
A380: PY2HN | B380: 77 | C380: 20 | D380: =ABS(B380+C380) -> 97
A381: PY1SGT | B381: 71 | C381: 22 | D381: =ABS(B381+C381) -> 93
A382: F6KRD | B382: 66 | C382: 20 | D382: =ABS(B382+C382) -> 86
A383: PY2RX | B383: 61 | C383: 24 | D383: =ABS(B383+C383) -> 85
A384: PY5AP | B384: 58 | C384: 27 | D384: =ABS(B384+C384) -> 85
A385: YE4IJ | B385: 63 | C385: 19 | D385: =ABS(B385+C385) -> 82
A386: NN6NN | B386: 51 | C386: 26 | D386: =ABS(B386+C386) -> 77
A387: KF6ILA | B387: 49 | C387: 24 | D387: =ABS(B387+C387) -> 73
A388: PY2EQ | B388: 52 | C388: 19 | D388: =ABS(B388+C388) -> 71
A389: K6DSW | B389: 46 | C389: 23 | D389: =ABS(B389+C389) -> 69
A390: G4BWP | B390: 53 | C390: 15 | D390: =ABS(B390+C390) -> 68
A391: PY2NDX | B391: 47 | C391: 18 | D391: =ABS(B391+C391) -> 65
A392: YB0NDT | B392: 36 | C392: 25 | D392: =ABS(B392+C392) -> 61
A393: DP1POL | B393: 40 | C393: 16 | D393: =ABS(B393+C393) -> 56
A394: PU2RSD | B394: 35 | C394: 17 | D394: =ABS(B394+C394) -> 52
A395: VE1DT | B395: 32 | C395: 14 | D395: =ABS(B395+C395) -> 46
A396: VE4HAZ | B396: 29 | C396: 12 | D396: =ABS(B396+C396) -> 41
A397: W3ZGD | B397: 6 | C397: 6 | D397: =ABS(B397+C397) -> 12
A398: FORMULA CLASS - 100W OPTION
A399: Callsign | B399: Countries | C399: Zones | D399: Score
A400: HA1ZH | B400: 270 | C400: 40 | D400: =ABS(B400+C400) -> 310
A401: W4TV | B401: 265 | C401: 39 | D401: =ABS(B401+C401) -> 304
A402: N4RI | B402: 240 | C402: 36 | D402: =ABS(B402+C402) -> 276
A403: *E73Y | B403: 235 | C403: 40 | D403: =ABS(B403+C403) -> 275
A404: K8CQ | B404: 235 | C404: 40 | D404: =ABS(B404+C404) -> 275
A405: SP3BGD | B405: 228 | C405: 38 | D405: =ABS(B405+C405) -> 266
A406: *AD1C | B406: 226 | C406: 39 | D406: =ABS(B406+C406) -> 265
A407: VE1RGB | B407: 224 | C407: 39 | D407: =ABS(B407+C407) -> 263
A408: YO6DDF | B408: 231 | C408: 31 | D408: =ABS(B408+C408) -> 262
A409: PY2KC | B409: 223 | C409: 38 | D409: =ABS(B409+C409) -> 261
A410: OK1WCF | B410: 223 | C410: 37 | D410: =ABS(B410+C410) -> 260
A411: JA1IRH | B411: 214 | C411: 40 | D411: =ABS(B411+C411) -> 254
A412: *PY5WD | B412: 216 | C412: 35 | D412: =ABS(B412+C412) -> 251
A413: HA7LJ | B413: 213 | C413: 37 | D413: =ABS(B413+C413) -> 250
A414: IN3FHE | B414: 206 | C414: 39 | D414: =ABS(B414+C414) -> 245
A415: W3ZL | B415: 204 | C415: 38 | D415: =ABS(B415+C415) -> 242
A416: KB3LIX | B416: 199 | C416: 38 | D416: =ABS(B416+C416) -> 237
A417: SQ9JKS | B417: 199 | C417: 38 | D417: =ABS(B417+C417) -> 237
A418: PP2RON | B418: 199 | C418: 37 | D418: =ABS(B418+C418) -> 236
A419: K2DBK | B419: 191 | C419: 37 | D419: =ABS(B419+C419) -> 228
A420: OK1BA | B420: 189 | C420: 39 | D420: =ABS(B420+C420) -> 228
A421: KA9MOM | B421: 186 | C421: 38 | D421: =ABS(B421+C421) -> 224
A422: N1AM | B422: 189 | C422: 34 | D422: =ABS(B422+C422) -> 223
A423: *YO4AAC | B423: 189 | C423: 34 | D423: =ABS(B423+C423) -> 223
A424: VU3NXI | B424: 181 | C424: 35 | D424: =ABS(B424+C424) -> 216
A425: FG8NY | B425: 181 | C425: 34 | D425: =ABS(B425+C425) -> 215
A426: W4KVS | B426: 178 | C426: 34 | D426: =ABS(B426+C426) -> 212
A427: AF5CC | B427: 168 | C427: 38 | D427: =ABS(B427+C427) -> 206
A428: JL6USD | B428: 171 | C428: 34 | D428: =ABS(B428+C428) -> 205
A429: *EW7SM | B429: 163 | C429: 39 | D429: =ABS(B429+C429) -> 202
A430: KF0IQ | B430: 168 | C430: 34 | D430: =ABS(B430+C430) -> 202
A431: W2OR | B431: 165 | C431: 37 | D431: =ABS(B431+C431) -> 202
A432: PP6ZZ | B432: 166 | C432: 35 | D432: =ABS(B432+C432) -> 201
A433: *K6LE | B433: 165 | C433: 34 | D433: =ABS(B433+C433) -> 199
A434: EA3FF | B434: 157 | C434: 36 | D434: =ABS(B434+C434) -> 193
A435: WX0Z | B435: 159 | C435: 34 | D435: =ABS(B435+C435) -> 193
A436: EI3CTB | B436: 160 | C436: 29 | D436: =ABS(B436+C436) -> 189
A437: OK1BLU | B437: 152 | C437: 35 | D437: =ABS(B437+C437) -> 187
A438: *YB2ERL | B438: 156 | C438: 30 | D438: =ABS(B438+C438) -> 186
A439: K9HWL | B439: 149 | C439: 34 | D439: =ABS(B439+C439) -> 183
A440: W6HGF | B440: 147 | C440: 33 | D440: =ABS(B440+C440) -> 180
A441: IK2FIL | B441: 141 | C441: 36 | D441: =ABS(B441+C441) -> 177
A442: KJ8O | B442: 142 | C442: 34 | D442: =ABS(B442+C442) -> 176
A443: VK6HG | B443: 142 | C443: 34 | D443: =ABS(B443+C443) -> 176
A444: WA2VQV | B444: 143 | C444: 28 | D444: =ABS(B444+C444) -> 171
A445: JA7OXR/1 | B445: 132 | C445: 37 | D445: =ABS(B445+C445) -> 169
A446: PY3KN | B446: 139 | C446: 30 | D446: =ABS(B446+C446) -> 169
A447: NU4I | B447: 138 | C447: 30 | D447: =ABS(B447+C447) -> 168
A448: PU8YPL | B448: 139 | C448: 28 | D448: =ABS(B448+C448) -> 167
A449: OO9O | B449: 130 | C449: 35 | D449: =ABS(B449+C449) -> 165
A450: PY4LH | B450: 132 | C450: 30 | D450: =ABS(B450+C450) -> 162
A451: YO8BGE | B451: 129 | C451: 33 | D451: =ABS(B451+C451) -> 162
A452: K9IA | B452: 127 | C452: 32 | D452: =ABS(B452+C452) -> 159
A453: DU2BOQ | B453: 127 | C453: 29 | D453: =ABS(B453+C453) -> 156
A454: CA3MRD | B454: 126 | C454: 29 | D454: =ABS(B454+C454) -> 155
A455: YF1AR | B455: 120 | C455: 35 | D455: =ABS(B455+C455) -> 155
A456: K7FLI | B456: 123 | C456: 31 | D456: =ABS(B456+C456) -> 154
A457: WF7T | B457: 120 | C457: 32 | D457: =ABS(B457+C457) -> 152
A458: CA3LGJ | B458: 120 | C458: 30 | D458: =ABS(B458+C458) -> 150
A459: OO2T | B459: 112 | C459: 34 | D459: =ABS(B459+C459) -> 146
A460: KJ4VTH | B460: 119 | C460: 24 | D460: =ABS(B460+C460) -> 143
A461: YC1EGP | B461: 111 | C461: 31 | D461: =ABS(B461+C461) -> 142
A462: IZ1MHY | B462: 110 | C462: 30 | D462: =ABS(B462+C462) -> 140
A463: FG4NO | B463: 112 | C463: 27 | D463: =ABS(B463+C463) -> 139
A464: W2GHD | B464: 107 | C464: 32 | D464: =ABS(B464+C464) -> 139
A465: VE3FCT | B465: 109 | C465: 27 | D465: =ABS(B465+C465) -> 136
A466: KD8SAV | B466: 107 | C466: 27 | D466: =ABS(B466+C466) -> 134
A467: PG1R | B467: 106 | C467: 27 | D467: =ABS(B467+C467) -> 133
A468: PJ7AA | B468: 99 | C468: 32 | D468: =ABS(B468+C468) -> 131
A469: JH1GBO | B469: 97 | C469: 31 | D469: =ABS(B469+C469) -> 128
A470: VK4BL | B470: 87 | C470: 32 | D470: =ABS(B470+C470) -> 119
A471: CO2VE | B471: 93 | C471: 25 | D471: =ABS(B471+C471) -> 118
A472: CE7FKG | B472: 100 | C472: 13 | D472: =ABS(B472+C472) -> 113
A473: CO2WL | B473: 91 | C473: 16 | D473: =ABS(B473+C473) -> 107
A474: 4S7JL | B474: 76 | C474: 27 | D474: =ABS(B474+C474) -> 103
A475: PU3LYB | B475: 71 | C475: 25 | D475: =ABS(B475+C475) -> 96
A476: K9WIS | B476: 71 | C476: 23 | D476: =ABS(B476+C476) -> 94
A477: YB9WAN | B477: 64 | C477: 22 | D477: =ABS(B477+C477) -> 86
A478: YB9WZJ | B478: 60 | C478: 25 | D478: =ABS(B478+C478) -> 85
A479: VK8HPB | B479: 54 | C479: 11 | D479: =ABS(B479+C479) -> 65
A480: W7JSD | B480: 44 | C480: 20 | D480: =ABS(B480+C480) -> 64
A481: S79MHY | B481: 45 | C481: 18 | D481: =ABS(B481+C481) -> 63
A482: YC1DML | B482: 45 | C482: 18 | D482: =ABS(B482+C482) -> 63
A483: XU7AEU | B483: 38 | C483: 15 | D483: =ABS(B483+C483) -> 53
A484: CT1AHU | B484: 36 | C484: 12 | D484: =ABS(B484+C484) -> 48
A485: I/IQ1KZ | B485: 26 | C485: 16 | D485: =ABS(B485+C485) -> 42
A486: CO2QU | B486: 20 | C486: 10 | D486: =ABS(B486+C486) -> 30
A487: FS/PJ7MF | B487: 13 | C487: 12 | D487: =ABS(B487+C487) -> 25
A488: PY1CPF | B488: 5 | C488: 3 | D488: =ABS(B488+C488) -> 8
A489: FORMULA CLASS - 10W OPTION
A490: Callsign | B490: Countries | C490: Zones | D490: Score
A491: WG5G | B491: 256 | C491: 39 | D491: =ABS(B491+C491) -> 295
A492: IV3AOL | B492: 229 | C492: 39 | D492: =ABS(B492+C492) -> 268
A493: W8QZA | B493: 226 | C493: 39 | D493: =ABS(B493+C493) -> 265
A494: ND0C | B494: 198 | C494: 38 | D494: =ABS(B494+C494) -> 236
A495: K8ZT | B495: 182 | C495: 38 | D495: =ABS(B495+C495) -> 220
A496: KD8NYO | B496: 179 | C496: 35 | D496: =ABS(B496+C496) -> 214
A497: NU4B | B497: 172 | C497: 34 | D497: =ABS(B497+C497) -> 206
A498: KD8NYP | B498: 154 | C498: 34 | D498: =ABS(B498+C498) -> 188
A499: W2WGK | B499: 156 | C499: 30 | D499: =ABS(B499+C499) -> 186
A500: IZ3NVR | B500: 133 | C500: 34 | D500: =ABS(B500+C500) -> 167
A501: ON2AD | B501: 124 | C501: 30 | D501: =ABS(B501+C501) -> 154
A502: VU2LBW | B502: 111 | C502: 34 | D502: =ABS(B502+C502) -> 145
A503: HB9CBR | B503: 111 | C503: 30 | D503: =ABS(B503+C503) -> 141
A504: VA1MM | B504: 72 | C504: 19 | D504: =ABS(B504+C504) -> 91
A505: PY1CMT | B505: 57 | C505: 20 | D505: =ABS(B505+C505) -> 77
A506: CO2HA | B506: 52 | C506: 20 | D506: =ABS(B506+C506) -> 72